{
  "schema_version": "dr-canary-execution-plan-v1.1",
  "provider": "zhipu-bigmodel",
  "model_id": "glm-5.3-flash",
  "endpoint": "https://open.bigmodel.cn/api/paas/v4/chat/completions",
  "channel": "ordinary_model_api",
  "text_only": true,
  "tools_enabled": false,
  "vision_enabled": false,
  "video_enabled": false,
  "files_enabled": false,
  "web_enabled": false,
  "parallel_enabled": false,
  "fallback_enabled": false,
  "max_provider_calls": 1,
  "max_retries": 0,
  "max_input_tokens": 512,
  "max_output_tokens": 256,
  "operation_timeout_seconds": 30,
  "run_deadline_seconds": 45,
  "monetary_budget_currency": "CNY",
  "monetary_budget_limit": "0.01",
  "pricing_type": "promotional",
  "input_price_per_million_tokens": "0.4",
  "output_price_per_million_tokens": "1.4",
  "approval_state": "user_authorized_single_call",
  "credential_environment_variable": "ZHIPUAI_API_KEY"
}
